{"schema":1,"platform":"3ds","generated":"2026-10-30","month":"2026-09","views":true,"source":"Wikidata (P400, sitelinks), Wikimedia pageviews (en.wikipedia)","games":{"CTR-A49":[8,0,0],"CTR-A66":[15,0,0],"CTR-A8F":[5,0,0],"CTR-A9A":[22,0,0],"CTR-A9E":[8,0,0],"CTR-AA8":[20,0,0],"CTR-AAC":[15,0,0],"CTR-AAH":[16,0,0],"CTR-AAL":[8,0,0],"CTR-ABA":[5,0,0],"CTR-ABB":[18,0,0],"CTR-ABE":[25,0,0],"CTR-ABL":[8,0,0],"CTR-ABM":[22,0,0],"CTR-ABN":[19,0,0],"CTR-ABQ":[19,0,0],"CTR-ABR":[24,0,0],"CTR-ABS":[12,0,0],"CTR-ABW":[16,0,0],"CTR-AC7":[18,0,0],"CTR-AC8":[17,0,0],"CTR-AC9":[12,0,0],"CTR-ACA":[20,0,0],"CTR-ACC":[20,0,0],"CTR-ACF":[21,0,0],"CTR-ACL":[15,0,0],"CTR-ACM":[23,0,0],"CTR-ACN":[18,0,0],"CTR-ACP":[10,0,0],"CTR-ACQ":[10,0,0],"CTR-ACV":[5,0,0],"CTR-ACZ":[5,0,0],"CTR-AD2":[5,0,0],"CTR-AD4":[18,0,0],"CTR-ADD":[19,0,0],"CTR-ADE":[10,0,0],"CTR-ADH":[8,0,0],"CTR-ADL":[12,0,0],"CTR-ADM":[5,0,0],"CTR-ADQ":[21,0,0],"CTR-ADR":[19,0,0],"CTR-ADT":[8,0,0],"CTR-AEB":[12,0,0],"CTR-AEG":[5,0,0],"CTR-AF3":[5,0,0],"CTR-AF8":[58,-41,0],"CTR-AFD":[5,0,0],"CTR-AFE":[21,0,0],"CTR-AFJ":[16,0,0],"CTR-AFL":[18,0,0],"CTR-AFR":[13,0,0],"CTR-AG3":[8,0,0],"CTR-AG5":[23,0,0],"CTR-AG6":[20,0,0],"CTR-AGA":[21,0,0],"CTR-AGF":[15,0,0],"CTR-AGG":[24,0,0],"CTR-AGK":[21,0,0],"CTR-AGL":[15,0,0],"CTR-AGP":[12,0,0],"CTR-AGR":[17,0,0],"CTR-AGU":[8,0,0],"CTR-AH6":[13,0,0],"CTR-AH8":[5,0,0],"CTR-AHC":[13,0,0],"CTR-AHF":[5,0,0],"CTR-AHP":[22,0,0],"CTR-AHR":[15,0,0],"CTR-AHS":[5,0,0],"CTR-AHX":[13,0,0],"CTR-AHY":[12,0,0],"CTR-AJ3":[20,0,0],"CTR-AJ8":[19,0,0],"CTR-AJ9":[5,0,0],"CTR-AJB":[13,0,0],"CTR-AJC":[5,0,0],"CTR-AJH":[13,0,0],"CTR-AJJ":[20,0,0],"CTR-AJR":[20,0,0],"CTR-AK2":[10,0,0],"CTR-AK3":[13,0,0],"CTR-AK8":[12,0,0],"CTR-AKG":[20,0,0],"CTR-AKH":[24,0,0],"CTR-AKK":[20,0,0],"CTR-AKM":[12,0,0],"CTR-AKS":[24,0,0],"CTR-AL4":[12,0,0],"CTR-AL6":[20,0,0],"CTR-ALA":[20,0,0],"CTR-ALC":[19,0,0],"CTR-ALE":[22,0,0],"CTR-ALF":[12,0,0],"CTR-ALG":[21,0,0],"CTR-ALL":[22,0,0],"CTR-ALZ":[16,0,0],"CTR-AM4":[8,0,0],"CTR-AM7":[68,-11,0],"CTR-AMC":[15,0,0],"CTR-AMD":[13,0,0],"CTR-AMJ":[23,0,0],"CTR-AMK":[60,14,0],"CTR-AMQ":[16,0,0],"CTR-AMX":[21,0,0],"CTR-AN3":[8,0,0],"CTR-AN4":[8,0,0],"CTR-AND":[24,0,0],"CTR-ANR":[20,0,0],"CTR-ANS":[61,-22,0],"CTR-ANT":[15,0,0],"CTR-ANX":[15,0,0],"CTR-APD":[22,0,0],"CTR-APG":[15,0,0],"CTR-API":[8,0,0],"CTR-APO":[8,0,0],"CTR-APP":[15,0,0],"CTR-APR":[15,0,0],"CTR-AQ2":[19,0,0],"CTR-AQ7":[16,0,0],"CTR-AQ8":[12,0,0],"CTR-AQE":[21,0,0],"CTR-AQL":[12,0,0],"CTR-AQN":[15,0,0],"CTR-AQQ":[20,0,0],"CTR-AQR":[5,0,0],"CTR-AR2":[8,0,0],"CTR-AR4":[17,0,0],"CTR-AR5":[13,0,0],"CTR-ARE":[61,9,0],"CTR-ARF":[8,0,0],"CTR-ARM":[62,11,0],"CTR-ARR":[19,0,0],"CTR-ART":[18,0,0],"CTR-ARV":[23,0,0],"CTR-AS3":[65,-11,0],"CTR-AS4":[8,0,0],"CTR-AS7":[20,0,0],"CTR-AS8":[20,0,0],"CTR-AS9":[5,0,0],"CTR-ASD":[19,0,0],"CTR-ASF":[21,0,0],"CTR-ASG":[15,0,0],"CTR-ASH":[10,0,0],"CTR-ASL":[18,0,0],"CTR-ASM":[19,0,0],"CTR-ASP":[22,0,0],"CTR-ASR":[18,0,0],"CTR-ASS":[12,0,0],"CTR-ASV":[15,0,0],"CTR-ASX":[5,0,0],"CTR-ASZ":[5,0,0],"CTR-AT8":[12,0,0],"CTR-ATA":[21,0,0],"CTR-ATH":[19,0,0],"CTR-ATK":[19,0,0],"CTR-ATL":[13,0,0],"CTR-ATN":[20,0,0],"CTR-ATS":[23,0,0],"CTR-ATT":[15,0,0],"CTR-AUN":[19,0,0],"CTR-AVH":[15,0,0],"CTR-AVM":[13,0,0],"CTR-AWA":[21,0,0],"CTR-AWE":[21,0,0],"CTR-AWR":[8,0,0],"CTR-AWS":[5,0,0],"CTR-AWW":[5,0,0],"CTR-AXC":[8,0,0],"CTR-AXR":[23,0,0],"CTR-AXX":[20,0,0],"CTR-AY3":[10,0,0],"CTR-AY9":[17,0,0],"CTR-AYE":[16,0,0],"CTR-AYM":[22,0,0],"CTR-AYN":[20,0,0],"CTR-AYW":[18,0,0],"CTR-AYX":[5,0,0],"CTR-AZE":[18,0,0],"CTR-AZG":[10,0,0],"CTR-AZJ":[5,0,0],"CTR-AZO":[5,0,0],"CTR-BAA":[22,0,0],"CTR-BAG":[17,0,0],"CTR-BAL":[21,0,0],"CTR-BB3":[19,0,0],"CTR-BBP":[12,0,0],"CTR-BC4":[8,0,0],"CTR-BC5":[13,0,0],"CTR-BCA":[19,0,0],"CTR-BCE":[15,0,0],"CTR-BD7":[8,0,0],"CTR-BDL":[15,0,0],"CTR-BE4":[8,0,0],"CTR-BFD":[17,0,0],"CTR-BFG":[5,0,0],"CTR-BFN":[12,0,0],"CTR-BFT":[58,-50,0],"CTR-BFX":[5,0,0],"CTR-BFY":[5,0,0],"CTR-BG2":[15,0,0],"CTR-BG4":[18,0,0],"CTR-BG6":[21,0,0],"CTR-BG9":[8,0,0],"CTR-BGM":[12,0,0],"CTR-BGX":[22,0,0],"CTR-BHD":[15,0,0],"CTR-BHR":[21,0,0],"CTR-BKK":[8,0,0],"CTR-BLD":[13,0,0],"CTR-BLF":[20,0,0],"CTR-BLH":[20,0,0],"CTR-BLJ":[22,0,0],"CTR-BLL":[15,0,0],"CTR-BLM":[16,0,0],"CTR-BLN":[15,0,0],"CTR-BLS":[16,0,0],"CTR-BLW":[22,0,0],"CTR-BM9":[13,0,0],"CTR-BMU":[15,0,0],"CTR-BNU":[12,0,0],"CTR-BPC":[19,0,0],"CTR-BPE":[8,0,0],"CTR-BPJ":[19,0,0],"CTR-BPM":[12,0,0],"CTR-BPN":[13,0,0],"CTR-BPP":[13,0,0],"CTR-BPX":[21,0,0],"CTR-BR3":[5,0,0],"CTR-BRB":[5,0,0],"CTR-BRC":[17,0,0],"CTR-BRG":[12,0,0],"CTR-BRM":[8,0,0],"CTR-BRP":[8,0,0],"CTR-BS3":[15,0,0],"CTR-BS6":[19,0,0],"CTR-BS8":[5,0,0],"CTR-BS9":[19,0,0],"CTR-BSE":[20,0,0],"CTR-BSF":[20,0,0],"CTR-BSK":[15,0,0],"CTR-BSY":[18,0,0],"CTR-BTE":[70,-12,0],"CTR-BTH":[16,0,0],"CTR-BTK":[8,0,0],"CTR-BTM":[20,0,0],"CTR-BTR":[22,0,0],"CTR-BTS":[19,0,0],"CTR-BUW":[15,0,0],"CTR-BWD":[13,0,0],"CTR-BXL":[13,0,0],"CTR-BXX":[20,0,0],"CTR-BYG":[5,0,0],"CTR-BYH":[5,0,0],"CTR-BYS":[5,0,0],"CTR-BZH":[8,0,0],"CTR-BZL":[24,0,0],"CTR-BZM":[13,0,0],"CTR-BZP":[25,0,0],"CTR-EA3":[23,0,0],"CTR-EC6":[23,0,0],"CTR-ECD":[15,0,0],"CTR-EDH":[22,0,0],"CTR-JA2":[13,0,0],"CTR-JAM":[15,0,0],"CTR-JAR":[5,0,0],"CTR-JAU":[15,0,0],"CTR-JB7":[19,0,0],"CTR-JBB":[5,0,0],"CTR-JBC":[15,0,0],"CTR-JBK":[5,0,0],"CTR-JBL":[5,0,0],"CTR-JC6":[25,0,0],"CTR-JCA":[18,0,0],"CTR-JCJ":[8,0,0],"CTR-JCN":[5,0,0],"CTR-JCP":[15,0,0],"CTR-JCZ":[5,0,0],"CTR-JD8":[13,0,0],"CTR-JD9":[24,0,0],"CTR-JDM":[5,0,0],"CTR-JEL":[8,0,0],"CTR-JEU":[23,0,0],"CTR-JEV":[5,0,0],"CTR-JF4":[5,0,0],"CTR-JFD":[10,0,0],"CTR-JFE":[63,19,0],"CTR-JFK":[5,0,0],"CTR-JGC":[15,0,0],"CTR-JGW":[12,0,0],"CTR-JHN":[5,0,0],"CTR-JHS":[8,0,0],"CTR-JK8":[5,0,0],"CTR-JKE":[10,0,0],"CTR-JKF":[8,0,0],"CTR-JKV":[8,0,0],"CTR-JKZ":[15,0,0],"CTR-JL2":[5,0,0],"CTR-JMD":[15,0,0],"CTR-JMF":[10,0,0],"CTR-JMG":[10,0,0],"CTR-JMS":[5,0,0],"CTR-JNS":[8,0,0],"CTR-JNU":[8,0,0],"CTR-JPM":[8,0,0],"CTR-JRG":[10,0,0],"CTR-JRJ":[5,0,0],"CTR-JRS":[5,0,0],"CTR-JRZ":[8,0,0],"CTR-JS4":[5,0,0],"CTR-JSA":[18,0,0],"CTR-JST":[18,0,0],"CTR-JT4":[13,0,0],"CTR-JT6":[5,0,0],"CTR-JUC":[10,0,0],"CTR-JUE":[15,0,0],"CTR-JUY":[8,0,0],"CTR-JV7":[16,0,0],"CTR-JVA":[10,0,0],"CTR-JVQ":[10,0,0],"CTR-JVV":[25,0,0],"CTR-JWC":[5,0,0],"CTR-JWG":[10,0,0],"CTR-JWP":[8,0,0],"CTR-JWV":[16,0,0],"CTR-JWX":[5,0,0],"CTR-JY5":[15,0,0],"CTR-JYL":[18,0,0],"CTR-JZG":[5,0,0],"CTR-KAA":[12,0,0],"CTR-KAS":[5,0,0],"CTR-KAW":[5,0,0],"CTR-KBW":[5,0,0],"CTR-KCA":[13,0,0],"CTR-KCC":[5,0,0],"CTR-KCD":[15,0,0],"CTR-KCK":[13,0,0],"CTR-KCN":[5,0,0],"CTR-KEP":[5,0,0],"CTR-KFL":[10,0,0],"CTR-KGB":[13,0,0],"CTR-KGW":[8,0,0],"CTR-KJE":[5,0,0],"CTR-KMG":[10,0,0],"CTR-KMJ":[5,0,0],"CTR-KMV":[13,0,0],"CTR-KMZ":[8,0,0],"CTR-KND":[5,0,0],"CTR-KPR":[5,0,0],"CTR-KQD":[13,0,0],"CTR-KQS":[5,0,0],"CTR-KR9":[8,0,0],"CTR-KRH":[5,0,0],"CTR-KSV":[16,0,0],"CTR-KSZ":[5,0,0],"CTR-KT6":[5,0,0],"CTR-KTW":[12,0,0],"CTR-KW4":[15,0,0],"CTR-KZS":[8,0,0],"CTR-KZV":[15,0,0],"CTR-NAC":[5,0,0],"KTR-CAF":[5,0,0],"KTR-CDP":[5,0,0],"KTR-CF3":[5,0,0]}}
